{
  "student_info": {
    "student_name": "王欢",
    "student_id": "202421044615",
    "class_name": "24级机电技术1班",
    "direction": "AFC自动售检票系统"
  },
  "project_info": {
    "topic": "解放西路站AFC检票机故障排查方案设计",
    "document_type": "毕业设计"
  },
  "project_object": "AFC检票机（自动检票闸机）",
  "application_scenario": "城市轨道交通车站",
  "main_problem": "AFC检票机故障排查流程不规范、效率低、经验积累不足",
  "design_goal": [
    "建立规范化故障排查流程",
    "总结常见故障典型排查路径",
    "建立故障分级响应机制",
    "积累排查经验与典型案例"
  ],
  "design_tasks": [
    "系统概述",
    "常见故障分析",
    "故障排查方案设计",
    "总结"
  ],
  "technical_route": [
    "主控单元",
    "读写器与天线",
    "门机系统",
    "通道传感器系统",
    "通信模块",
    "电源模块",
    "故障分类",
    "排查流程"
  ],
  "key_points": [
    "解放西路站高客流场景",
    "门翼开关异常",
    "通行检测不准",
    "防夹失效",
    "通信中断",
    "分级响应"
  ],
  "defense_focus": [
    "AFC系统组成",
    "故障排查流程",
    "检修等级与周期",
    "安全保护"
  ],
  "result_focus": [
    "系统概述",
    "故障分析",
    "排查方案",
    "快速排查表"
  ]
}